{
  "$schema": "http://json-schema.org/draft-04/schema#",
  "id": "pacbio.secondary.schemas.job.datastore",
  "version": "0.1.0",
  "title": "Job Datastore",
  "description": "Array of job datastore files",
  "type": "array",
  "minItems": 1,
  "items": {
    "type": "object",
    "properties": {
      "fileTypeId": {
        "title": "File Type Id",
        "description": "File type identifier, e.g. PacBio.FileTypes.JsonReport",
        "type": "string"
      },
      "sourceId": {
        "title": "Source Id",
        "description": "Source identifier of this datastore, e.g. pbscala::import_dataset",
        "type": "string"
      },
      "uuid": {
        "title": "UUID",
        "description": "UUID of the datastore file",
        "type": "string",
        "format": "uuid",
        "pattern": "^[a-fA-F0-9]{8}-[a-fA-F0-9]{4}-[a-fA-F0-9]{4}-[a-fA-F0-9]{4}-[a-fA-F0-9]{12}$"
      },
      "jobId": {
        "title": "Job Id",
        "description": "Identifier of the job that emitted this datastore file",
        "type": "integer"
      },
      "jobUUID": {
        "title": "Job UUID",
        "description": "UUID of the job that emitted this datastore file",
        "type": "string",
        "format": "uuid",
        "pattern": "^[a-fA-F0-9]{8}-[a-fA-F0-9]{4}-[a-fA-F0-9]{4}-[a-fA-F0-9]{4}-[a-fA-F0-9]{12}$"
      },
      "createdAt": {
        "title": "Created at",
        "description": "Time when this datastore file was created",
        "type": "string",
        "format": "date-time"
      },
      "importedAt": {
        "title": "Imported at",
        "description": "Time when this datastore file was imported",
        "type": "string",
        "format": "date-time"
      },
      "modifiedAt": {
        "title": "Modified at",
        "description": "Time when this datastore file was modified",
        "type": "string",
        "format": "date-time"
      },
      "path": {
        "title": "Datastore File Path",
        "description": "Path to the datastore file",
        "type": "string",
        "format": "uri"
      },
      "fileSize": {
        "title": "Datastore File Size",
        "description": "Size of the datastore file",
        "type": "integer"
      }
    },
    "required": [
      "fileTypeId",
      "sourceId",
      "uuid",
      "jobId",
      "jobUUID",
      "createdAt",
      "importedAt",
      "modifiedAt",
      "path",
      "fileSize"
    ]
  },
  "additionalItems": false
}

