[{
		"modifiedAt" : "2015-11-18T12:58:47.944",
		"fileTypeId" : "PacBio.DataSet.AlignmentSet",
		"path" : "/pbi/dept/secondary/siv/smrtlink/smrtlink-beta/smrtsuite_166987/userdata/jobs_root/000/000038/tasks/pbsmrtpipe.tasks.gather_alignmentset-1/file.alignmentset.xml",
		"uuid" : "a8284a60-5b17-1744-6c31-44264dffdbb0",
		"fileSize" : 89832,
		"importedAt" : "2015-11-18T12:58:47.944",
		"jobId" : 38,
		"createdAt" : "2015-11-18T12:58:47.944",
		"jobUUID" : "ea3c0962-f37b-43b6-82b3-051d41dc82c0",
		"sourceId" : "pbsmrtpipe.tasks.gather_alignmentset-PacBio.DataSet.AlignmentSet"
	}, {
		"modifiedAt" : "2015-11-18T13:00:21.104",
		"fileTypeId" : "PacBio.FileTypes.JsonReport",
		"path" : "/pbi/dept/secondary/siv/smrtlink/smrtlink-beta/smrtsuite_166987/userdata/jobs_root/000/000038/tasks/pbreports.tasks.mapping_stats-0/mapping_stats_report.json",
		"uuid" : "63e31de0-d295-41e6-bf1a-8d3beda06892",
		"fileSize" : 6326,
		"importedAt" : "2015-11-18T13:00:21.104",
		"jobId" : 38,
		"createdAt" : "2015-11-18T13:00:21.104",
		"jobUUID" : "ea3c0962-f37b-43b6-82b3-051d41dc82c0",
		"sourceId" : "pbreports.tasks.mapping_stats-PacBio.FileTypes.JsonReport"
	}, {
		"modifiedAt" : "2015-11-18T13:00:43.196",
		"fileTypeId" : "PacBio.FileTypes.gff",
		"path" : "/pbi/dept/secondary/siv/smrtlink/smrtlink-beta/smrtsuite_166987/userdata/jobs_root/000/000038/tasks/pbsmrtpipe.tasks.gather_gff-1/file.gff",
		"uuid" : "0e89ecf9-416f-439d-bfe4-78e539b41454",
		"fileSize" : 21783,
		"importedAt" : "2015-11-18T13:00:43.196",
		"jobId" : 38,
		"createdAt" : "2015-11-18T13:00:43.196",
		"jobUUID" : "ea3c0962-f37b-43b6-82b3-051d41dc82c0",
		"sourceId" : "pbsmrtpipe.tasks.gather_gff-PacBio.FileTypes.gff"
	}, {
		"modifiedAt" : "2015-11-18T13:00:51.943",
		"fileTypeId" : "PacBio.DataSet.ContigSet",
		"path" : "/pbi/dept/secondary/siv/smrtlink/smrtlink-beta/smrtsuite_166987/userdata/jobs_root/000/000038/tasks/pbsmrtpipe.tasks.gather_contigset-1/file.contigset.xml",
		"uuid" : "2d0c7852-0050-6bd3-d6af-0d8020112f54",
		"fileSize" : 11886,
		"importedAt" : "2015-11-18T13:00:51.943",
		"jobId" : 38,
		"createdAt" : "2015-11-18T13:00:51.943",
		"jobUUID" : "ea3c0962-f37b-43b6-82b3-051d41dc82c0",
		"sourceId" : "pbsmrtpipe.tasks.gather_contigset-PacBio.DataSet.ContigSet"
	}, {
		"modifiedAt" : "2015-11-18T13:00:56.217",
		"fileTypeId" : "PacBio.FileTypes.Fastq",
		"path" : "/pbi/dept/secondary/siv/smrtlink/smrtlink-beta/smrtsuite_166987/userdata/jobs_root/000/000038/tasks/pbsmrtpipe.tasks.gather_fastq-1/file.fastq",
		"uuid" : "9d310ee2-e15b-4683-80af-2c7af2415075",
		"fileSize" : 99068,
		"importedAt" : "2015-11-18T13:00:56.217",
		"jobId" : 38,
		"createdAt" : "2015-11-18T13:00:56.217",
		"jobUUID" : "ea3c0962-f37b-43b6-82b3-051d41dc82c0",
		"sourceId" : "pbsmrtpipe.tasks.gather_fastq-PacBio.FileTypes.Fastq"
	}, {
		"modifiedAt" : "2015-11-18T13:01:05.093",
		"fileTypeId" : "PacBio.FileTypes.log",
		"path" : "/pbi/dept/secondary/siv/smrtlink/smrtlink-beta/smrtsuite_166987/userdata/jobs_root/000/000038/logs/master.log",
		"uuid" : "3ba3fad4-613f-477e-b397-8464d5c366a3",
		"fileSize" : 634,
		"importedAt" : "2015-11-18T13:01:05.093",
		"jobId" : 38,
		"createdAt" : "2015-11-18T13:01:05.093",
		"jobUUID" : "ea3c0962-f37b-43b6-82b3-051d41dc82c0",
		"sourceId" : "pbsmrtpipe::master.log"
	}, {
		"modifiedAt" : "2015-11-18T13:01:05.287",
		"fileTypeId" : "PacBio.FileTypes.log",
		"path" : "/pbi/dept/secondary/siv/smrtlink/smrtlink-beta/smrtsuite_166987/userdata/jobs_root/000/000038/logs/pbsmrtpipe.log",
		"uuid" : "9c183df8-f7eb-475f-a0f7-e3697370b1dd",
		"fileSize" : 0,
		"importedAt" : "2015-11-18T13:01:05.287",
		"jobId" : 38,
		"createdAt" : "2015-11-18T13:01:05.287",
		"jobUUID" : "ea3c0962-f37b-43b6-82b3-051d41dc82c0",
		"sourceId" : "pbsmrtpipe::pbsmrtpipe.log"
	}
]